{
  "reviewedAt": "2026-07-30T10:00:00Z",
  "reviewer": "R3-completeness-bot",
  "phase": 1,
  "dimension": "completeness",
  "findings": [
    {
      "severity": "FYI",
      "description": "Out of Scope 声明完整",
      "evidence": "requirement-spec.md §Out of Scope L45-50"
    }
  ],
  "passed": true
}
